[
  {
    "test_id": "OWN-FEAT-B-BOX",
    "class": "boundary",
    "scenario_locator": "#/scenarios/OWN-FEAT-B-BOX",
    "scenario_sha256": "1419b5abee88173e4c28a7ac60ee5d0b9eade80b54bf3d9bc01ab4777ac1ba00",
    "step_count": 2,
    "step_input_sha256s": [
      "5a7b90fa22ea2052259b53dd532ae4329ad231db773d027d1031b4b84da05f99",
      "b01b9a4a9b9eccc5ce2bd97f867d4411effb081e6f936ebf8b534a6f29fe9e00"
    ],
    "final_evaluator_result": "ADMIT",
    "semantic_oracle_key_or_null": null,
    "primary_diagnostic_id_or_null": null,
    "legacy_semantic_side_channel_read_count": 0,
    "execution_status": "SPECIFIED_NOT_RUN",
    "product_support": "NOT_RUN"
  },
  {
    "test_id": "OWN-FEAT-N-BOX",
    "class": "negative",
    "scenario_locator": "#/scenarios/OWN-FEAT-N-BOX",
    "scenario_sha256": "6366842c2235ad52b94b09e13963beda4be5514fc080f39dad2a17e2f3413668",
    "step_count": 1,
    "step_input_sha256s": [
      "984177b8ca46bca38c4e36e9eb3d02f1474f72ca42839566c47545935f02b1f3"
    ],
    "final_evaluator_result": "REJECT",
    "semantic_oracle_key_or_null": "BOX_OWNERSHIP_VIOLATION",
    "primary_diagnostic_id_or_null": "BOX_OWNERSHIP_VIOLATION",
    "legacy_semantic_side_channel_read_count": 0,
    "execution_status": "SPECIFIED_NOT_RUN",
    "product_support": "NOT_RUN"
  },
  {
    "test_id": "OWN-FEAT-P-BOX",
    "class": "positive",
    "scenario_locator": "#/scenarios/OWN-FEAT-P-BOX",
    "scenario_sha256": "ceb64d239e8efd4d7618c3f3a4eadd22b7f5c5c6810c291e3a56b5f20b2c31dc",
    "step_count": 1,
    "step_input_sha256s": [
      "9761679edfc7120f0ea9126dc2dfd29104a0ee25114a31fbe521da60971451bd"
    ],
    "final_evaluator_result": "ADMIT",
    "semantic_oracle_key_or_null": null,
    "primary_diagnostic_id_or_null": null,
    "legacy_semantic_side_channel_read_count": 0,
    "execution_status": "SPECIFIED_NOT_RUN",
    "product_support": "NOT_RUN"
  },
  {
    "test_id": "OWN-GAP-B-013",
    "class": "boundary",
    "scenario_locator": "#/scenarios/OWN-GAP-B-013",
    "scenario_sha256": "36adcf5b29594a9166a1e8dce96ea44f0a56bf1a760bda4b0cfc3e17757557be",
    "step_count": 2,
    "step_input_sha256s": [
      "44e25b01a9f5749234123b6a5aae9cce67359a8d57c379319b5f8de3294872ad",
      "9781ddded2dc6fd73c0db08caf777b89e3fc37f4028ddcf58547a14f09dbd9b4"
    ],
    "final_evaluator_result": "REJECT",
    "semantic_oracle_key_or_null": "PLACE_STATE_JOIN_MISMATCH",
    "primary_diagnostic_id_or_null": "PLACE_STATE_JOIN_MISMATCH",
    "legacy_semantic_side_channel_read_count": 0,
    "execution_status": "SPECIFIED_NOT_RUN",
    "product_support": "NOT_RUN"
  },
  {
    "test_id": "OWN-GAP-N-013",
    "class": "negative",
    "scenario_locator": "#/scenarios/OWN-GAP-N-013",
    "scenario_sha256": "6bca6a24f051f569225b04b6cf544d12eea532057319cbcb714595af08c543ab",
    "step_count": 1,
    "step_input_sha256s": [
      "26e19af874c9f3b44a1a7e5abd8f749879be439fe430a973cf576bd6d6f3c5c8"
    ],
    "final_evaluator_result": "REJECT",
    "semantic_oracle_key_or_null": "INOUT_ALIAS_CONFLICT",
    "primary_diagnostic_id_or_null": "INOUT_ALIAS_CONFLICT",
    "legacy_semantic_side_channel_read_count": 0,
    "execution_status": "SPECIFIED_NOT_RUN",
    "product_support": "NOT_RUN"
  },
  {
    "test_id": "OWN-GAP-P-013",
    "class": "positive",
    "scenario_locator": "#/scenarios/OWN-GAP-P-013",
    "scenario_sha256": "7d559403dabb74f682dcdb4303a065032b9131e276129ad5102d76657c375711",
    "step_count": 1,
    "step_input_sha256s": [
      "91bbc8f350c8b773e826460b36cd98fc7173bcdfca3dc19b3df0f93aa923aca1"
    ],
    "final_evaluator_result": "ADMIT",
    "semantic_oracle_key_or_null": null,
    "primary_diagnostic_id_or_null": null,
    "legacy_semantic_side_channel_read_count": 0,
    "execution_status": "SPECIFIED_NOT_RUN",
    "product_support": "NOT_RUN"
  },
  {
    "test_id": "OWN-PLACE-B-013",
    "class": "boundary",
    "scenario_locator": "#/scenarios/OWN-PLACE-B-013",
    "scenario_sha256": "e540afb66011a7e783c2c8930bd76939ad063fa9cb6a109da16c8bf27c4de084",
    "step_count": 2,
    "step_input_sha256s": [
      "0f286e510daabca7ff60dad0aa0fd8815a6869dd2b81aa134bc25fe4d0ea35c6",
      "1b79cf6289a4a30eb96128a26ff175a24be3dab9e2eed7fce3772ad402815eae"
    ],
    "final_evaluator_result": "ADMIT",
    "semantic_oracle_key_or_null": null,
    "primary_diagnostic_id_or_null": null,
    "legacy_semantic_side_channel_read_count": 0,
    "execution_status": "SPECIFIED_NOT_RUN",
    "product_support": "NOT_RUN"
  },
  {
    "test_id": "OWN-PLACE-B-014",
    "class": "boundary",
    "scenario_locator": "#/scenarios/OWN-PLACE-B-014",
    "scenario_sha256": "2930d320fc0cf7935ae45e191510673236274619d667c94de49c7f871f4b930a",
    "step_count": 1,
    "step_input_sha256s": [
      "eb0b3dde5eb47ea4da3abe0cb04d654274785b43212b57ce04762b552be1b739"
    ],
    "final_evaluator_result": "ADMIT",
    "semantic_oracle_key_or_null": null,
    "primary_diagnostic_id_or_null": null,
    "legacy_semantic_side_channel_read_count": 0,
    "execution_status": "SPECIFIED_NOT_RUN",
    "product_support": "NOT_RUN"
  },
  {
    "test_id": "OWN-PLACE-B-015",
    "class": "boundary",
    "scenario_locator": "#/scenarios/OWN-PLACE-B-015",
    "scenario_sha256": "152c47c309d25b4725072ae02eacc39f50410ec0947611a3658637e6f98543d7",
    "step_count": 1,
    "step_input_sha256s": [
      "ab0368ef6ced432f3f41c79a7300bb464a75b67947b4f936f693d8bdd864f74e"
    ],
    "final_evaluator_result": "ADMIT",
    "semantic_oracle_key_or_null": null,
    "primary_diagnostic_id_or_null": null,
    "legacy_semantic_side_channel_read_count": 0,
    "execution_status": "SPECIFIED_NOT_RUN",
    "product_support": "NOT_RUN"
  },
  {
    "test_id": "OWN-PLACE-M-022",
    "class": "mutation",
    "scenario_locator": "#/scenarios/OWN-PLACE-M-022",
    "scenario_sha256": "d0575862bbe68255cc55e71fb81c78e7bcb489e9b7f96fb661a40417df355aaa",
    "step_count": 1,
    "step_input_sha256s": [
      "a7d973295fcbed78915d1d23afc6f98908551c7762a852ee4bf9f859dc8affe2"
    ],
    "final_evaluator_result": "INPUT_INVALID",
    "semantic_oracle_key_or_null": "PLACE_OVERLAP_PROOF_INVALID",
    "primary_diagnostic_id_or_null": null,
    "legacy_semantic_side_channel_read_count": 0,
    "execution_status": "SPECIFIED_NOT_RUN",
    "product_support": "NOT_RUN"
  },
  {
    "test_id": "OWN-PLACE-N-016",
    "class": "negative",
    "scenario_locator": "#/scenarios/OWN-PLACE-N-016",
    "scenario_sha256": "790c7ccf2a9bb9af2f128af33b8a25dd11c82bd1f3a65032abf7ed638f434a50",
    "step_count": 1,
    "step_input_sha256s": [
      "84d5b389c6fb5ca2373f6aab587f20b86865647b5a284e0a1b6a172d037533d4"
    ],
    "final_evaluator_result": "REJECT",
    "semantic_oracle_key_or_null": "USE_AFTER_MOVE",
    "primary_diagnostic_id_or_null": "OWNERSHIP_MODE_ADMISSION_FAILED",
    "legacy_semantic_side_channel_read_count": 0,
    "execution_status": "SPECIFIED_NOT_RUN",
    "product_support": "NOT_RUN"
  },
  {
    "test_id": "OWN-PLACE-N-017",
    "class": "negative",
    "scenario_locator": "#/scenarios/OWN-PLACE-N-017",
    "scenario_sha256": "2ee15d8cc5746b79bcd78a7596b7a9e03a55ca778cee77bfb4d558f20db46a2e",
    "step_count": 1,
    "step_input_sha256s": [
      "4307c6f4286bbdfc64b6f10e63085f4b13c3527728e21db056102068d6dff852"
    ],
    "final_evaluator_result": "REJECT",
    "semantic_oracle_key_or_null": "INOUT_ALIAS_CONFLICT",
    "primary_diagnostic_id_or_null": "INOUT_ALIAS_CONFLICT",
    "legacy_semantic_side_channel_read_count": 0,
    "execution_status": "SPECIFIED_NOT_RUN",
    "product_support": "NOT_RUN"
  },
  {
    "test_id": "OWN-PLACE-N-018",
    "class": "negative",
    "scenario_locator": "#/scenarios/OWN-PLACE-N-018",
    "scenario_sha256": "54b6120bbacc11a312cccec3d45193239834975c9d3b95a2623158ed377279c7",
    "step_count": 1,
    "step_input_sha256s": [
      "29cfc65c0c391d40c2854a9d6e747bf736a326c4f13ad55f4fd478ec9a8c61d7"
    ],
    "final_evaluator_result": "REJECT",
    "semantic_oracle_key_or_null": "BORROW_CONFLICT_MUTATION",
    "primary_diagnostic_id_or_null": "OWNERSHIP_MODE_ADMISSION_FAILED",
    "legacy_semantic_side_channel_read_count": 0,
    "execution_status": "SPECIFIED_NOT_RUN",
    "product_support": "NOT_RUN"
  },
  {
    "test_id": "OWN-PLACE-N-019",
    "class": "negative",
    "scenario_locator": "#/scenarios/OWN-PLACE-N-019",
    "scenario_sha256": "4c4a8991aa09809fab6f8a566218a72d69dc0637a56892b96cea3d88365d55fc",
    "step_count": 1,
    "step_input_sha256s": [
      "d0b0f9db45df8d8421e75bf2d54effcbd47304f81ae4f71942f265d34ee4df39"
    ],
    "final_evaluator_result": "REJECT",
    "semantic_oracle_key_or_null": "INOUT_ALIAS_CONFLICT",
    "primary_diagnostic_id_or_null": "INOUT_ALIAS_CONFLICT",
    "legacy_semantic_side_channel_read_count": 0,
    "execution_status": "SPECIFIED_NOT_RUN",
    "product_support": "NOT_RUN"
  },
  {
    "test_id": "OWN-PLACE-N-020",
    "class": "negative",
    "scenario_locator": "#/scenarios/OWN-PLACE-N-020",
    "scenario_sha256": "51871b45061da51d67496f0b7cf35fcd934061e7658d5916c85c70becfb57168",
    "step_count": 2,
    "step_input_sha256s": [
      "37cf798317fbdbcecc12927c5d69f19064df51400f3cff3c584da7f850e10db4",
      "aaa0e6343c32e5da7eb5aa67547c9e783ad7619395c408c20a7b411332e4b02f"
    ],
    "final_evaluator_result": "REJECT",
    "semantic_oracle_key_or_null": "PLACE_STATE_JOIN_MISMATCH",
    "primary_diagnostic_id_or_null": "PLACE_STATE_JOIN_MISMATCH",
    "legacy_semantic_side_channel_read_count": 0,
    "execution_status": "SPECIFIED_NOT_RUN",
    "product_support": "NOT_RUN"
  },
  {
    "test_id": "OWN-PLACE-P-009",
    "class": "positive",
    "scenario_locator": "#/scenarios/OWN-PLACE-P-009",
    "scenario_sha256": "f8cdd582528fab30acef5abe23fc1a440fea51599b3cea32b123243461e6dbbc",
    "step_count": 1,
    "step_input_sha256s": [
      "31b778da63d17536ebcffb860bbbe252dc47695947f7efbb6d8d69e50628a872"
    ],
    "final_evaluator_result": "ADMIT",
    "semantic_oracle_key_or_null": null,